,0,1
187,download_data_path/process_wavs/183.wav,here's one thing to keep in mind flu can be very deadly about .1% of people who become infected with the flu will die from it
188,download_data_path/process_wavs/110.wav,some of us may feel like we have nothing to hide and so nothing to fear
189,download_data_path/process_wavs/79.wav,now we don't know what these standards are yet and we don't know how permanent they could be
190,download_data_path/process_wavs/169.wav,I like everyone else Abrams has come up with ways to make it work
191,download_data_path/process_wavs/2.wav,his show GPS is a forum for discussion on global Affairs featuring conversations with political and Business Leaders from around the world
192,download_data_path/process_wavs/24.wav,we are learning they can get from humans and in rare situations pass it on to other pets
193,download_data_path/process_wavs/200.wav,I asked dr. McDonald about how he's coping with his everyday reality as well as the loss of a colleague
194,download_data_path/process_wavs/73.wav,then there are the antibody tests those are the ones that can determine whether or not someone has had covid-19 in the past and might have some immunity to it now
195,download_data_path/process_wavs/75.wav,this is dangerous it won't work and it could get you really sick so let me repeat it once more don't drink any cleaning products
196,download_data_path/process_wavs/231.wav,I wanted to know what role technology might play in our fight against this pandemic
197,download_data_path/process_wavs/103.wav,in other words you probably won't get the coronavirus in the water but you could get it from someone close to you in the water
198,download_data_path/process_wavs/16.wav,"the number of Medicare beneficiaries who receive telemedicine visits Rose from 10,000 a week to 300,000 a week in the last week of March according to the Wall Street Journal"
199,download_data_path/process_wavs/21.wav,officials were concerned that this was motivated by these conspiracy theories
200,download_data_path/process_wavs/127.wav,he's been on the Frontline for weeks taking care of patient after patient after patient
201,download_data_path/process_wavs/34.wav,I recently spoke with dr. Steven McDonald he's an ER doctor at the same hospital is dr. Breen
202,download_data_path/process_wavs/62.wav,our boarding passes are already on our phones and we already check in online
203,download_data_path/process_wavs/30.wav,fortunately deal was scheduled for a routine ultrasound on April 15th
204,download_data_path/process_wavs/235.wav,she's an epidemiologist at the Johns Hopkins Center for Health security
205,download_data_path/process_wavs/168.wav,Lynch said it's already begun
206,download_data_path/process_wavs/155.wav,the most common and most accurate test we have is called a PCR test a polymerase Chain Reaction test
207,download_data_path/process_wavs/76.wav,At first she didn't know what it was
208,download_data_path/process_wavs/206.wav,now the vaccine may not protect you entirely but it could shorten the duration if you get it
209,download_data_path/process_wavs/223.wav,I talked with him about how and when students from pre-k to college Michael back to classrooms
210,download_data_path/process_wavs/249.wav,this won't surprise you
211,download_data_path/process_wavs/213.wav,it's actually borrowed one method of calming her students down from a children's yoga certification course
212,download_data_path/process_wavs/195.wav,the benefit on average was about 31%
213,download_data_path/process_wavs/262.wav,this is one of them
214,download_data_path/process_wavs/27.wav,Dr Kristal and his team also established a buddy system pairing healthcare workers with their peers
215,download_data_path/process_wavs/258.wav,if an antigen test is approved and mass-produced it may serve as a valuable screening tool
216,download_data_path/process_wavs/145.wav,what is probably not going to replace the PCR saliva or swab test when it comes to diagnosing covid-19
217,download_data_path/process_wavs/15.wav,but we who was a finalist for this year's James Beard Rising Star Chef award has still managed to find a silver lining
218,download_data_path/process_wavs/98.wav,does that sort of translate ultimately into distrust
219,download_data_path/process_wavs/105.wav,you don't need to worry about getting covid-19 in your tap water
220,download_data_path/process_wavs/46.wav,and she's hoping the industry as a whole does the same especially in the areas where it was struggling
221,download_data_path/process_wavs/164.wav,I want you to listen to how dr. foutch she responded when asked about this in a Snapchat interview
222,download_data_path/process_wavs/268.wav,christening this is another Chris said there were hiccups using videoconferencing at first
223,download_data_path/process_wavs/83.wav,now there's another kind of test that could be useful here it's called an antigen test
224,download_data_path/process_wavs/254.wav,these days she struggles to get her students to sit still in front of the camera
225,download_data_path/process_wavs/163.wav,attacked the American College of Emergency Physicians called the claims Reckless untested and inconsistent with any current science or epidemiology regarding covid-19
226,download_data_path/process_wavs/273.wav,but recently a government-funded study found that hospitalized patients who took remedez of your intravenously recovered about 4 days faster than patients who didn't
227,download_data_path/process_wavs/129.wav,learning online might seem easy enough if you're a student with a computer where the internet but they are also has students who didn't have the luxury of these tools
228,download_data_path/process_wavs/72.wav,a reliable antigen test for the coronavirus isn't yet available in the United States
229,download_data_path/process_wavs/117.wav,Lori Abrams finds is challenging to
230,download_data_path/process_wavs/170.wav,will those under quarantine have to wear wristbands
231,download_data_path/process_wavs/146.wav,here's the problem antibody test have not been consistently accurate there are a lot of bad tests out there
232,download_data_path/process_wavs/54.wav,she has a history of kidney stones and realized that that would explain the pain
233,download_data_path/process_wavs/239.wav,restaurants are already testing out new methods
234,download_data_path/process_wavs/194.wav,deette was in and out of the hospital in less than an hour
235,download_data_path/process_wavs/47.wav,but he thinks he knows what it's going to take to find them
236,download_data_path/process_wavs/275.wav,another country the note South Korea which has been applauded for how well it handled the pandemic thanks to its thorough testing and contact tracing process
237,download_data_path/process_wavs/272.wav,I keep in mind emergency use authorization doesn't mean that this is an FDA-approved drug
238,download_data_path/process_wavs/196.wav,so how available are PCR and antibody tests to the general public is probably the question I get more than any other
239,download_data_path/process_wavs/256.wav,let me be clear about this under no circumstances should you ingest or inject any cleaning products
240,download_data_path/process_wavs/36.wav,but that doesn't mean pools may not be shut down in certain areas this summer
241,download_data_path/process_wavs/261.wav,so I decided to call him again to talk about all the changes in travel that have happened just over the last couple months and all the changes he thinks will still happen in the future
242,download_data_path/process_wavs/189.wav,Lee is taking this time to rethink how a restaurant should operate
243,download_data_path/process_wavs/124.wav,Wyckoff has been proud of how well his dude and set the Johnston County Career and Technical Leadership Academy have taken the online classes
244,download_data_path/process_wavs/14.wav,that could help stop infected people from spreading the virus before they even show symptoms
245,download_data_path/process_wavs/265.wav,if you're testing for antibodies and you get a false positive people may incorrectly assumed they now have the antibodies and are protected and then go out in the public and keep spreading
246,download_data_path/process_wavs/90.wav,we decided to ask Erica Richter from the American Society of travel advisors
247,download_data_path/process_wavs/31.wav,with the antibody test what you really hoping to avoid is a false positive
248,download_data_path/process_wavs/246.wav,I hear some big differences first of all the flu has been around for a while
249,download_data_path/process_wavs/42.wav,but again the initial rollout of those tests was fraught with problems and that caused major delays in the country's early response to the pandemic
250,download_data_path/process_wavs/50.wav,what do you think has been the most surprising change to travel since we last spoke
251,download_data_path/process_wavs/130.wav,the ACLU recently put out guidelines about how we can safely and effectively use technology in contact racing while also minimizing our privacy risks
252,download_data_path/process_wavs/252.wav,I've heard that from my colleagues everyday they wander are they safe
253,download_data_path/process_wavs/234.wav,for some experts that means we're going to have to rely on technology for touchless travel
254,download_data_path/process_wavs/67.wav,it didn't work back then
255,download_data_path/process_wavs/264.wav,why because you would think that you don't have the virus and then you might go back out into the community into a nursing home into a hospital and potentially infect people
256,download_data_path/process_wavs/199.wav,it's thoughtful its innovative is what's necessary
257,download_data_path/process_wavs/144.wav,the cat is out of the bag so to speak on this one
258,download_data_path/process_wavs/70.wav,you may have already had one of these if you ever had a test for strep throat or the flu
259,download_data_path/process_wavs/77.wav,every day this week I'm going to be talking to experts from all different fields about what we can expect in the months and years to come the future of travel education surveillance and more
260,download_data_path/process_wavs/85.wav,Plaza Monday Johns Hopkins University's covet tracking project was reporting over 7 million people in the United States have been tested
261,download_data_path/process_wavs/241.wav,hospitals have quickly taken their services online
262,download_data_path/process_wavs/119.wav,but as you might imagine this system has raised some concerns about privacy rights
263,download_data_path/process_wavs/222.wav,are there advantages that this type of learning offers over bricks and mortar
264,download_data_path/process_wavs/106.wav,if we're looking at that sort of timeline which people have suggested as possible given the vaccine production that is necessary and all that
265,download_data_path/process_wavs/26.wav,he had to furlough around 800 workers in this week decided to close two of his restaurants
266,download_data_path/process_wavs/89.wav,we do use contact racing in this country for other diseases lot of people are hearing this term for the first time
267,download_data_path/process_wavs/221.wav,and then there is Clearview AI a facial recognition technology company
268,download_data_path/process_wavs/7.wav,the agency said Monday that it was tightening its policy to keep on proving and even fraudulent s from entering the market
269,download_data_path/process_wavs/80.wav,but that's the long-term
270,download_data_path/process_wavs/197.wav,some of the photos show pulley systems delivering coffee temperature checks at the door
271,download_data_path/process_wavs/132.wav,if all goes well results usually come back within a few hours but I can take a few days if you have to send it to a lab somewhere
272,download_data_path/process_wavs/274.wav,and remember this testing does need to go hand-in-hand with contact racing
273,download_data_path/process_wavs/5.wav,since then there have been a lot of unauthorized unvalidated tests which it flooded the market
274,download_data_path/process_wavs/175.wav,at least two cats and a dog have tested positive in the United States
275,download_data_path/process_wavs/122.wav,when we first began this podcast I talked about travel safety all the way back in the 4th episode with dr. Henry Wu
